{
  "$schema": "../../schemas/module.schema.json",
  "id": "habitat",
  "name": "Habitat",
  "zone": "crew",
  "length": 160,
  "couples": {
    "fore": true,
    "aft": true
  },
  "description": "A wheel on three spokes, turning for gravity. A few thousand workers live here, under the company mark.",
  "designer": "Witchspace",
  "credits": {
    "authors": [
      "Witchspace contributors"
    ],
    "license": "CC-BY-SA-4.0",
    "aiAssisted": true,
    "notes": "A core module, from Mark's modular Titanoboa (25 October 2026)."
  },
  "geometry": {
    "vertices": [
      [70, 70, 45],
      [-70, 70, 45],
      [-70, -70, 45],
      [70, -70, 45],
      [70, 70, -45],
      [-70, 70, -45],
      [-70, -70, -45],
      [70, -70, -45],
      [340, 0, 35],
      [170, 294.4, 35],
      [-170, 294.4, 35],
      [-340, 0, 35],
      [-170, -294.4, 35],
      [170, -294.4, 35],
      [340, 0, -35],
      [170, 294.4, -35],
      [-170, 294.4, -35],
      [-340, 0, -35],
      [-170, -294.4, -35],
      [170, -294.4, -35],
      [275, 0, 35],
      [137.5, 238.2, 35],
      [-137.5, 238.2, 35],
      [-275, 0, 35],
      [-137.5, -238.2, 35],
      [137.5, -238.2, 35],
      [275, 0, -35],
      [137.5, 238.2, -35],
      [-137.5, 238.2, -35],
      [-275, 0, -35],
      [-137.5, -238.2, -35],
      [137.5, -238.2, -35],
      [0, -70, 12],
      [0, -280, 12],
      [0, -280, -12],
      [0, -70, -12],
      [60.6, 35, 12],
      [242.5, 140, 12],
      [242.5, 140, -12],
      [60.6, 35, -12],
      [-60.6, 35, 12],
      [-242.5, 140, 12],
      [-242.5, 140, -12],
      [-60.6, 35, -12]
    ],
    "faces": [
      [3, 2, 1, 0],
      [0, 1, 5, 4],
      [1, 2, 6, 5],
      [2, 3, 7, 6],
      [3, 0, 4, 7],
      [4, 5, 6, 7],
      [14, 15, 9, 8],
      [15, 16, 10, 9],
      [16, 17, 11, 10],
      [17, 18, 12, 11],
      [18, 19, 13, 12],
      [19, 14, 8, 13],
      [20, 21, 27, 26],
      [21, 22, 28, 27],
      [22, 23, 29, 28],
      [23, 24, 30, 29],
      [24, 25, 31, 30],
      [25, 20, 26, 31],
      [20, 8, 9, 21],
      [14, 26, 27, 15],
      [21, 9, 10, 22],
      [15, 27, 28, 16],
      [22, 10, 11, 23],
      [16, 28, 29, 17],
      [23, 11, 12, 24],
      [17, 29, 30, 18],
      [24, 12, 13, 25],
      [18, 30, 31, 19],
      [25, 13, 8, 20],
      [19, 31, 26, 14],
      [35, 34, 33, 32],
      [39, 38, 37, 36],
      [43, 42, 41, 40]
    ]
  },
  "insignia": {
    "color": "#f4f1e4",
    "vertices": [
      [-23, 295.44863728670913, 32.2],
      [-11.5, 295.44863728670913, -11],
      [-11.5, 295.44863728670913, -11],
      [0, 295.44863728670913, 17.8],
      [0, 295.44863728670913, 17.8],
      [11.5, 295.44863728670913, -11],
      [11.5, 295.44863728670913, -11],
      [23, 295.44863728670913, 32.2],
      [-28.8, 295.44863728670913, -23],
      [-26.6, 295.44863728670913, -26.4],
      [-26.6, 295.44863728670913, -26.4],
      [-20.4, 295.44863728670913, -29.3],
      [-20.4, 295.44863728670913, -29.3],
      [-11, 295.44863728670913, -31.2],
      [-11, 295.44863728670913, -31.2],
      [0, 295.44863728670913, -31.7],
      [0, 295.44863728670913, -31.7],
      [11, 295.44863728670913, -31.2],
      [11, 295.44863728670913, -31.2],
      [20.4, 295.44863728670913, -29.3],
      [20.4, 295.44863728670913, -29.3],
      [26.6, 295.44863728670913, -26.4],
      [26.6, 295.44863728670913, -26.4],
      [28.8, 295.44863728670913, -23],
      [-3.4, 295.44863728670913, 2.4],
      [0, 295.44863728670913, -3.4],
      [0, 295.44863728670913, -3.4],
      [3.4, 295.44863728670913, 2.4],
      [0, 295.44863728670913, -3.4],
      [0, 295.44863728670913, -9.1]
    ],
    "lines": [
      [0, 1],
      [2, 3],
      [4, 5],
      [6, 7],
      [8, 9],
      [10, 11],
      [12, 13],
      [14, 15],
      [16, 17],
      [18, 19],
      [20, 21],
      [22, 23],
      [24, 25],
      [26, 27],
      [28, 29]
    ]
  }
}
