{
  "$schema": "../../schemas/module.schema.json",
  "id": "fabricator",
  "name": "Fabricator",
  "zone": "fabrication",
  "length": 520,
  "couples": {
    "fore": true,
    "aft": true
  },
  "description": "An open cradle where station sections are made. They leave by the sides, and so, occasionally, does the crew.",
  "designer": "Witchspace",
  "credits": {
    "authors": [
      "Witchspace contributors"
    ],
    "license": "CC-BY-SA-4.0",
    "aiAssisted": true,
    "notes": "A core module, from Mark's modular Titanoboa (25 October 2026)."
  },
  "geometry": {
    "vertices": [
      [70, 70, 225],
      [-70, 70, 225],
      [-70, -70, 225],
      [70, -70, 225],
      [70, 70, -225],
      [-70, 70, -225],
      [-70, -70, -225],
      [70, -70, -225],
      [-18, -258, -195],
      [18, -258, -195],
      [18, -222, -195],
      [-18, -222, -195],
      [-18, -258, 195],
      [18, -258, 195],
      [18, -222, 195],
      [-18, -222, 195],
      [-18, 222, -195],
      [18, 222, -195],
      [18, 258, -195],
      [-18, 258, -195],
      [-18, 222, 195],
      [18, 222, 195],
      [18, 258, 195],
      [-18, 258, 195],
      [-14, -258, 195],
      [14, -258, 195],
      [14, 258, 195],
      [-14, 258, 195],
      [-14, -258, 225],
      [14, -258, 225],
      [14, 258, 225],
      [-14, 258, 225],
      [-14, -258, -225],
      [14, -258, -225],
      [14, 258, -225],
      [-14, 258, -225],
      [-14, -258, -195],
      [14, -258, -195],
      [14, 258, -195],
      [-14, 258, -195]
    ],
    "faces": [
      [0, 1, 2, 3],
      [4, 5, 1, 0],
      [5, 6, 2, 1],
      [6, 7, 3, 2],
      [7, 4, 0, 3],
      [7, 6, 5, 4],
      [8, 9, 10, 11],
      [15, 14, 13, 12],
      [12, 13, 9, 8],
      [13, 14, 10, 9],
      [14, 15, 11, 10],
      [15, 12, 8, 11],
      [16, 17, 18, 19],
      [23, 22, 21, 20],
      [20, 21, 17, 16],
      [21, 22, 18, 17],
      [22, 23, 19, 18],
      [23, 20, 16, 19],
      [24, 25, 26, 27],
      [31, 30, 29, 28],
      [28, 29, 25, 24],
      [29, 30, 26, 25],
      [30, 31, 27, 26],
      [31, 28, 24, 27],
      [32, 33, 34, 35],
      [39, 38, 37, 36],
      [36, 37, 33, 32],
      [37, 38, 34, 33],
      [38, 39, 35, 34],
      [39, 36, 32, 35]
    ]
  }
}
