{
  "$schema": "../../schemas/module.schema.json",
  "id": "reactor",
  "name": "Reactor",
  "zone": "power",
  "length": 300,
  "couples": {
    "fore": true,
    "aft": true
  },
  "description": "A compact core behind a shadow shield, so everyone else lives in its shade, and four vanes shedding its heat.",
  "designer": "Witchspace",
  "credits": {
    "authors": [
      "Witchspace contributors"
    ],
    "license": "CC-BY-SA-4.0",
    "aiAssisted": true,
    "notes": "A core module, from Mark's modular Titanoboa (25 October 2026)."
  },
  "geometry": {
    "vertices": [
      [212.5, 88, 115],
      [88, 212.5, 115],
      [-88, 212.5, 115],
      [-212.5, 88, 115],
      [-212.5, -88, 115],
      [-88, -212.5, 115],
      [88, -212.5, 115],
      [212.5, -88, 115],
      [212.5, 88, 95],
      [88, 212.5, 95],
      [-88, 212.5, 95],
      [-212.5, 88, 95],
      [-212.5, -88, 95],
      [-88, -212.5, 95],
      [88, -212.5, 95],
      [212.5, -88, 95],
      [129.3, 53.6, 95],
      [53.6, 129.3, 95],
      [-53.6, 129.3, 95],
      [-129.3, 53.6, 95],
      [-129.3, -53.6, 95],
      [-53.6, -129.3, 95],
      [53.6, -129.3, 95],
      [129.3, -53.6, 95],
      [129.3, 53.6, -115],
      [53.6, 129.3, -115],
      [-53.6, 129.3, -115],
      [-129.3, 53.6, -115],
      [-129.3, -53.6, -115],
      [-53.6, -129.3, -115],
      [53.6, -129.3, -115],
      [129.3, -53.6, -115],
      [99, 99, 65],
      [311.1, 311.1, 65],
      [311.1, 311.1, -100],
      [99, 99, -100],
      [-99, 99, 65],
      [-311.1, 311.1, 65],
      [-311.1, 311.1, -100],
      [-99, 99, -100],
      [-99, -99, 65],
      [-311.1, -311.1, 65],
      [-311.1, -311.1, -100],
      [-99, -99, -100],
      [99, -99, 65],
      [311.1, -311.1, 65],
      [311.1, -311.1, -100],
      [99, -99, -100]
    ],
    "faces": [
      [0, 1, 2, 3, 4, 5, 6, 7],
      [8, 9, 1, 0],
      [9, 10, 2, 1],
      [10, 11, 3, 2],
      [11, 12, 4, 3],
      [12, 13, 5, 4],
      [13, 14, 6, 5],
      [14, 15, 7, 6],
      [15, 8, 0, 7],
      [15, 14, 13, 12, 11, 10, 9, 8],
      [16, 17, 18, 19, 20, 21, 22, 23],
      [24, 25, 17, 16],
      [25, 26, 18, 17],
      [26, 27, 19, 18],
      [27, 28, 20, 19],
      [28, 29, 21, 20],
      [29, 30, 22, 21],
      [30, 31, 23, 22],
      [31, 24, 16, 23],
      [31, 30, 29, 28, 27, 26, 25, 24],
      [32, 33, 34, 35],
      [36, 37, 38, 39],
      [40, 41, 42, 43],
      [44, 45, 46, 47]
    ]
  }
}
