{
  "$schema": "../../schemas/module.schema.json",
  "id": "drive",
  "name": "Drive",
  "zone": "power",
  "length": 300,
  "couples": {
    "fore": true,
    "aft": false
  },
  "description": "A block and three bells: fitted to move a station, or stacked with a fuel module to fly modules between the stars. She never hurries.",
  "designer": "Witchspace",
  "credits": {
    "authors": [
      "Witchspace contributors"
    ],
    "license": "CC-BY-SA-4.0",
    "aiAssisted": true,
    "notes": "A core module, from Mark's modular Titanoboa (25 October 2026)."
  },
  "geometry": {
    "vertices": [
      [129.9, 57.5, 115],
      [0, 115, 115],
      [-129.9, 57.5, 115],
      [-129.9, -57.5, 115],
      [0, -115, 115],
      [129.9, -57.5, 115],
      [164.5, 72.5, -40],
      [0, 145, -40],
      [-164.5, 72.5, -40],
      [-164.5, -72.5, -40],
      [0, -145, -40],
      [164.5, -72.5, -40],
      [-60.4, 65, -40],
      [-95, 85, -40],
      [-129.6, 65, -40],
      [-129.6, 25, -40],
      [-95, 5, -40],
      [-60.4, 25, -40],
      [-32.6, 81, -150],
      [-95, 117, -150],
      [-157.4, 81, -150],
      [-157.4, 9, -150],
      [-95, -27, -150],
      [-32.6, 9, -150],
      [129.6, 65, -40],
      [95, 85, -40],
      [60.4, 65, -40],
      [60.4, 25, -40],
      [95, 5, -40],
      [129.6, 25, -40],
      [157.4, 81, -150],
      [95, 117, -150],
      [32.6, 81, -150],
      [32.6, 9, -150],
      [95, -27, -150],
      [157.4, 9, -150],
      [34.6, -55, -40],
      [0, -35, -40],
      [-34.6, -55, -40],
      [-34.6, -95, -40],
      [0, -115, -40],
      [34.6, -95, -40],
      [62.4, -39, -150],
      [0, -3, -150],
      [-62.4, -39, -150],
      [-62.4, -111, -150],
      [0, -147, -150],
      [62.4, -111, -150]
    ],
    "faces": [
      [0, 1, 2, 3, 4, 5],
      [6, 7, 1, 0],
      [7, 8, 2, 1],
      [8, 9, 3, 2],
      [9, 10, 4, 3],
      [10, 11, 5, 4],
      [11, 6, 0, 5],
      [11, 10, 9, 8, 7, 6],
      [12, 13, 14, 15, 16, 17],
      [18, 19, 13, 12],
      [19, 20, 14, 13],
      [20, 21, 15, 14],
      [21, 22, 16, 15],
      [22, 23, 17, 16],
      [23, 18, 12, 17],
      [23, 22, 21, 20, 19, 18],
      [24, 25, 26, 27, 28, 29],
      [30, 31, 25, 24],
      [31, 32, 26, 25],
      [32, 33, 27, 26],
      [33, 34, 28, 27],
      [34, 35, 29, 28],
      [35, 30, 24, 29],
      [35, 34, 33, 32, 31, 30],
      [36, 37, 38, 39, 40, 41],
      [42, 43, 37, 36],
      [43, 44, 38, 37],
      [44, 45, 39, 38],
      [45, 46, 40, 39],
      [46, 47, 41, 40],
      [47, 42, 36, 41],
      [47, 46, 45, 44, 43, 42]
    ]
  }
}
