{
  "$schema": "../../schemas/module.schema.json",
  "id": "hold",
  "name": "Hold",
  "zone": "logistics",
  "length": 320,
  "couples": {
    "fore": true,
    "aft": true
  },
  "description": "Four cells for refined metal and imported goods around the spine, and a pad on each side for three tugs.",
  "designer": "Witchspace",
  "credits": {
    "authors": [
      "Witchspace contributors"
    ],
    "license": "CC-BY-SA-4.0",
    "aiAssisted": true,
    "notes": "A core module, from Mark's modular Titanoboa (25 October 2026)."
  },
  "geometry": {
    "vertices": [
      [70, 70, 125],
      [-70, 70, 125],
      [-70, -70, 125],
      [70, -70, 125],
      [70, 70, -125],
      [-70, 70, -125],
      [-70, -70, -125],
      [70, -70, -125],
      [80, 80, -105],
      [220, 80, -105],
      [220, 220, -105],
      [80, 220, -105],
      [80, 80, 105],
      [220, 80, 105],
      [220, 220, 105],
      [80, 220, 105],
      [-220, 80, -105],
      [-80, 80, -105],
      [-80, 220, -105],
      [-220, 220, -105],
      [-220, 80, 105],
      [-80, 80, 105],
      [-80, 220, 105],
      [-220, 220, 105],
      [-220, -220, -105],
      [-80, -220, -105],
      [-80, -80, -105],
      [-220, -80, -105],
      [-220, -220, 105],
      [-80, -220, 105],
      [-80, -80, 105],
      [-220, -80, 105],
      [80, -220, -105],
      [220, -220, -105],
      [220, -80, -105],
      [80, -80, -105],
      [80, -220, 105],
      [220, -220, 105],
      [220, -80, 105],
      [80, -80, 105],
      [80, 0, 95],
      [400, 0, 95],
      [400, 0, -95],
      [80, 0, -95],
      [-80, 0, 95],
      [-400, 0, 95],
      [-400, 0, -95],
      [-80, 0, -95]
    ],
    "faces": [
      [3, 2, 1, 0],
      [0, 1, 5, 4],
      [1, 2, 6, 5],
      [2, 3, 7, 6],
      [3, 0, 4, 7],
      [4, 5, 6, 7],
      [11, 10, 9, 8],
      [12, 13, 14, 15],
      [8, 9, 13, 12],
      [9, 10, 14, 13],
      [10, 11, 15, 14],
      [11, 8, 12, 15],
      [19, 18, 17, 16],
      [20, 21, 22, 23],
      [16, 17, 21, 20],
      [17, 18, 22, 21],
      [18, 19, 23, 22],
      [19, 16, 20, 23],
      [27, 26, 25, 24],
      [28, 29, 30, 31],
      [24, 25, 29, 28],
      [25, 26, 30, 29],
      [26, 27, 31, 30],
      [27, 24, 28, 31],
      [35, 34, 33, 32],
      [36, 37, 38, 39],
      [32, 33, 37, 36],
      [33, 34, 38, 37],
      [34, 35, 39, 38],
      [35, 32, 36, 39],
      [43, 42, 41, 40],
      [47, 46, 45, 44]
    ]
  }
}
