{
  "$schema": "../../schemas/module.schema.json",
  "id": "science",
  "name": "Science",
  "zone": "add-on",
  "length": 220,
  "couples": {
    "fore": true,
    "aft": true
  },
  "description": "A sealed pod on a mast, at arm's length from everyone, for whatever the explorers found living here. Ejectable.",
  "designer": "Witchspace",
  "credits": {
    "authors": [
      "Witchspace contributors"
    ],
    "license": "CC-BY-SA-4.0",
    "aiAssisted": true,
    "notes": "A core module, from Mark's modular Titanoboa (25 October 2026)."
  },
  "geometry": {
    "vertices": [
      [112.6, 65, 75],
      [0, 130, 75],
      [-112.6, 65, 75],
      [-112.6, -65, 75],
      [0, -130, 75],
      [112.6, -65, 75],
      [112.6, 65, -75],
      [0, 130, -75],
      [-112.6, 65, -75],
      [-112.6, -65, -75],
      [0, -130, -75],
      [112.6, -65, -75],
      [14, 112.6, 20],
      [14, 300, 20],
      [-14, 300, 20],
      [-14, 112.6, 20],
      [14, 112.6, -20],
      [14, 300, -20],
      [-14, 300, -20],
      [-14, 112.6, -20],
      [60.6, 465, 75],
      [0, 500, 75],
      [-60.6, 465, 75],
      [-60.6, 395, 75],
      [0, 360, 75],
      [60.6, 395, 75],
      [129.9, 505, 0],
      [0, 580, 0],
      [-129.9, 505, 0],
      [-129.9, 355, 0],
      [0, 280, 0],
      [129.9, 355, 0],
      [60.6, 465, -75],
      [0, 500, -75],
      [-60.6, 465, -75],
      [-60.6, 395, -75],
      [0, 360, -75],
      [60.6, 395, -75]
    ],
    "faces": [
      [0, 1, 2, 3, 4, 5],
      [6, 7, 1, 0],
      [7, 8, 2, 1],
      [8, 9, 3, 2],
      [9, 10, 4, 3],
      [10, 11, 5, 4],
      [11, 6, 0, 5],
      [11, 10, 9, 8, 7, 6],
      [12, 13, 14, 15],
      [19, 18, 17, 16],
      [16, 17, 13, 12],
      [17, 18, 14, 13],
      [18, 19, 15, 14],
      [19, 16, 12, 15],
      [20, 21, 22, 23, 24, 25],
      [26, 27, 21, 20],
      [27, 28, 22, 21],
      [28, 29, 23, 22],
      [29, 30, 24, 23],
      [30, 31, 25, 24],
      [31, 26, 20, 25],
      [32, 33, 27, 26],
      [33, 34, 28, 27],
      [34, 35, 29, 28],
      [35, 36, 30, 29],
      [36, 37, 31, 30],
      [37, 32, 26, 31],
      [37, 36, 35, 34, 33, 32]
    ]
  }
}
