{
  "$schema": "../../schemas/module.schema.json",
  "id": "maw",
  "name": "Maw",
  "zone": "intake",
  "length": 300,
  "couples": {
    "fore": false,
    "aft": true
  },
  "description": "The intake. A wide mouth that takes in a moon a little at a time, from haulers that never have to land.",
  "designer": "Witchspace",
  "credits": {
    "authors": [
      "Witchspace contributors"
    ],
    "license": "CC-BY-SA-4.0",
    "aiAssisted": true,
    "notes": "A core module, from Mark's modular Titanoboa (25 October 2026)."
  },
  "geometry": {
    "vertices": [
      [216.5, 95, 150],
      [0, 190, 150],
      [-216.5, 95, 150],
      [-216.5, -95, 150],
      [0, -190, 150],
      [216.5, -95, 150],
      [103.9, 45.5, 20],
      [0, 91, 20],
      [-103.9, 45.5, 20],
      [-103.9, -45.5, 20],
      [0, -91, 20],
      [103.9, -45.5, 20],
      [121.2, 53, -115],
      [0, 106, -115],
      [-121.2, 53, -115],
      [-121.2, -53, -115],
      [0, -106, -115],
      [121.2, -53, -115]
    ],
    "faces": [
      [0, 1, 7, 6],
      [1, 2, 8, 7],
      [2, 3, 9, 8],
      [3, 4, 10, 9],
      [4, 5, 11, 10],
      [5, 0, 6, 11],
      [6, 7, 8, 9, 10, 11],
      [12, 13, 1, 0],
      [13, 14, 2, 1],
      [14, 15, 3, 2],
      [15, 16, 4, 3],
      [16, 17, 5, 4],
      [17, 12, 0, 5],
      [17, 16, 15, 14, 13, 12]
    ]
  }
}
